{
  "_contract": "atom/v1",
  "kind": "atom",
  "name": "rust-extract-impl-methods",
  "version": 1,
  "subcontract": "refactor/v1",
  "manifest": {
    "description": "Extract named inherent impl methods into a target submodule file with full module wiring, visibility adjustment, import organization, compile repair, and validation in one compound run.",
    "when_to_use": [
      "moving a cluster of methods from one impl block into a child submodule",
      "single-domain extraction from a god-impl (for multi-domain use rust-split-god-impl)",
      "operator has method names in hand and knows the target submodule path"
    ],
    "anti_patterns": [
      "do not use for multi-partition god-impl splits — use rust-split-god-impl instead",
      "do not use to move top-level items (structs, enums, functions) — use rust-extract-to-submodule",
      "do not use when methods need different visibility from each other — fall back to manual plan sequence",
      "do not use on non-Rust files"
    ],
    "inputs": {
      "schema": {
        "type": "object",
        "required": ["project_dir", "source_file", "target_file", "impl_name", "method_names"],
        "properties": {
          "project_dir": { "type": "string", "description": "Absolute path to the Rust project root." },
          "source_file": { "type": "string", "description": "File containing the source impl block, relative to project_dir." },
          "target_file": { "type": "string", "description": "Target submodule file (e.g. src/server/search.rs), relative to project_dir." },
          "impl_name": { "type": "string", "description": "Exact impl name as reported by bbox_refactor_status (e.g. `impl BlackboxServer`)." },
          "method_names": {
            "type": "array",
            "minItems": 1,
            "items": { "type": "string" },
            "description": "Method names to extract from the impl block."
          },
          "module_name": {
            "type": "string",
            "description": "Module name for the mod declaration. Defaults to target_file stem."
          },
          "visibility": {
            "type": "string",
            "description": "Visibility for the mod declaration. Supports `pub` and `pub(crate)`."
          },
          "target_prelude": {
            "type": "string",
            "description": "Prelude for the target file. Defaults to `use super::*;`."
          },
          "router_name": {
            "type": "string",
            "description": "Optional router wrapper name (e.g. `search_tools`) for a #[tool_router] wrapper impl."
          },
          "router_export_name": {
            "type": "string",
            "description": "Optional public helper function name for the router export."
          },
          "skip_organize_imports": {
            "type": "boolean",
            "description": "Skip the rust_organize_imports step after extraction."
          },
          "targeted_tests": {
            "type": "array",
            "items": { "type": "string" },
            "description": "Test names to run after the final cargo check."
          },
          "apply": { "type": "boolean" },
          "validation_bin": { "type": "string" }
        }
      },
      "prompt_template": "You are rust-extract-impl-methods. Charter: Extract named inherent impl methods into a target submodule with full wiring.\n\nProtocol:\n\n1. Ground the target structurally:\n   bbox_refactor_status(file=\"{{source_file}}\", project_dir=\"{{project_dir}}\",\n                         item_names={{method_names}}, item_kinds=[\"impl_method\"])\n   Confirm every requested method resolves inside {{impl_name}}.\n\n2. Plan the compound run using the split_rust_impl_methods_to_submodule macro:\n   This macro (bbox_refactor_run-only, not bbox_refactor_plan) expands to:\n     add_rust_mod_decl → extract_rust_impl_methods → rust_organize_imports →\n     cargo check (with rustc JSON capture) → rust_compile_fix_round →\n     cargo check → targeted tests.\n   The atom MUST use bbox_refactor_run with a single plan step of\n   kind=\"split_rust_impl_methods_to_submodule\".\n\n3. Decide:\n   - If any method name does not resolve in the impl block, block.\n   - If the target_file already exists and is non-empty, proceed but note it\n     (extract_rust_impl_methods appends; it does not refuse existing targets).\n   - Otherwise proceed.\n\n4. Apply when {{apply}} is true; otherwise return plan-only:\n   bbox_refactor_run(dispatch_origin=\"agent\",\n                     title=\"rust-extract-impl-methods {{source_file}} to {{target_file}}\",\n                     project_dir=\"{{project_dir}}\", confirm=true,\n                     steps=[\n     {\"op\":\"plan\",\"kind\":\"split_rust_impl_methods_to_submodule\",\n      \"source\":\"{{source_file}}\",\"target\":\"{{target_file}}\",\n      \"item_names\":{{method_names}},\"impl_name\":\"{{impl_name}}\",\n      \"module_name\":\"{{module_name}}\",\"visibility\":\"{{visibility}}\",\n      \"target_prelude\":\"{{target_prelude}}\",\n      \"router_name\":\"{{router_name}}\",\n      \"router_export_name\":\"{{router_export_name}}\",\n      \"toml_entries\":{\"skip_organize_imports\":{{skip_organize_imports}},\n                       \"targeted_tests\":{{targeted_tests}}}}\n   ])\n   Inspect the step reports. If cargo check failed and compile_fix applied,\n   report the fix details. If the final cargo check failed, the run rolled\n   back — report that.\n\n5. Emit done note:\n   bbox_note(kind=\"done\", body=<one-line summary: methods extracted, files\n     touched, compile status>).\n\nStrict refusal rules:\n- Never call bbox_refactor_plan with kind=split_rust_impl_methods_to_submodule\n  — it is a run-only macro.\n- Never invent method names from the user prompt — re-derive from\n  bbox_refactor_status.\n- Never use this atom for top-level items; use rust-extract-to-submodule.\n\nInputs:\n{{project_dir}} {{source_file}} {{target_file}} {{impl_name}} {{method_names}}"
    },
    "outputs": {
      "schema": {
        "type": "object",
        "required": ["status"],
        "properties": {
          "status": { "enum": ["planned", "applied", "blocked", "errored"] },
          "plan_path": { "type": "string" },
          "files_touched": { "type": "array", "items": { "type": "string" } },
          "methods_extracted": { "type": "array", "items": { "type": "string" } },
          "cargo_result": {
            "type": "object",
            "properties": {
              "command": { "type": "string" },
              "exit_code": { "type": "integer" },
              "summary": { "type": "string" },
              "rolled_back": { "type": "boolean" }
            }
          },
          "block_reason": { "type": "string" },
          "done_note_id": { "type": "string" }
        }
      },
      "evidence_density": "high"
    },
    "effects": {
      "writes_files": true,
      "dispatches_runs": 1,
      "max_depth": 0,
      "uses_network": false
    },
    "composition": { "may_invoke_atoms": { "kind": "none" } },
    "implementation": {
      "kind": "profile",
      "brofile_ref": "brofile:rust-refactor-persona@v1"
    },
    "supervision": { "oracle": "default" },
    "trace": { "retain": "summary", "portal_focus": "on_attention" },
    "cost_class": "normal",
    "provenance": {
      "kind": "hand_authored",
      "author": "blackbox-refactor-agents",
      "created_at": "2026-05-14T00:00:00Z"
    }
  }
}
