{
  "_contract": "atom/v1",
  "kind": "atom",
  "name": "java-singletonify-static-util",
  "version": 1,
  "subcontract": "refactor/v1",
  "manifest": {
    "description": "Rewrite callers of `*Util.staticMethod(...)` calls to `*UtilProvider.get().method(...)` for one source file. v1 ships the call-site rewrite half of note-e5439c0a; the Util-class-to-@Singleton conversion + purity classification is v2.",
    "when_to_use": [
      "redirect callers of a god-Util's static methods toward an injected provider before deleting/converting the Util class itself"
    ],
    "anti_patterns": [
      "do not use on pure formatter methods that genuinely belong as statics — those should stay as utility methods",
      "do not use without first staging the @Inject provider field on the caller's enclosing class"
    ],
    "inputs": {
      "schema": {
        "type": "object",
        "required": ["project_dir", "source", "impl_name", "new_text", "item_names"],
        "properties": {
          "project_dir": { "type": "string" },
          "source": { "type": "string" },
          "impl_name": { "type": "string", "description": "Util class name (e.g. `UIUtils`)." },
          "new_text": { "type": "string", "description": "Replacement receiver expression (e.g. `uiUtilsProvider.get()`)." },
          "item_names": { "type": "array", "items": { "type": "string" }, "minItems": 1, "description": "Static method names to rewrite." }
        }
      },
      "prompt_template": "You are java-singletonify-static-util. Charter: Rewrite `<Util>.<staticMethod>(...)` calls to `<provider>.get().<method>(...)`.\n\nProtocol:\n\n1. Ground.\n2. Verify provider field exists; refuse if missing.\n3. Plan with item_kinds=[\"method\"]:\n   bbox_refactor_plan(kind=\"replace_java_static_reference\",\n                      deep_analysis=true,\n                      project_dir=\"{{project_dir}}\",\n                      source=\"{{source}}\",\n                      impl_name=\"{{impl_name}}\",\n                      new_text=\"{{new_text}}\",\n                      item_names={{item_names}},\n                      item_kinds=[\"method\"])\n4. Apply and compile-verify.\n\nInputs:\n{{project_dir}} {{source}} {{impl_name}} {{new_text}} {{item_names}}"
    },
    "outputs": {
      "schema": {
        "type": "object",
        "required": ["status"],
        "properties": {
          "status": { "enum": ["planned", "applied", "blocked", "errored"] },
          "plan_path": { "type": "string" },
          "files_touched": { "type": "array", "items": { "type": "string" } },
          "fixme_count": { "type": "object", "properties": { "plan_only": { "type": "integer", "minimum": 0 }, "warning": { "type": "integer", "minimum": 0 } } },
          "deep_analysis_summary": { "type": "object", "additionalProperties": true },
          "cargo_result": { "type": "object", "properties": { "command": { "type": "string" }, "exit_code": { "type": "integer" }, "summary": { "type": "string" }, "rolled_back": { "type": "boolean" } } },
          "block_reason": { "type": "string" },
          "done_note_id": { "type": "string" },
          "callers_rewritten": { "type": "integer", "minimum": 0 }
        }
      },
      "evidence_density": "medium"
    },
    "effects": { "writes_files": true, "dispatches_runs": 1, "max_depth": 0, "uses_network": false },
    "composition": { "may_invoke_atoms": { "kind": "none" } },
    "implementation": { "kind": "profile", "brofile_ref": "brofile:java-refactor-persona@v1" },
    "supervision": { "oracle": "default" },
    "trace": { "retain": "summary", "portal_focus": "on_attention" },
    "cost_class": "cheap",
    "provenance": { "kind": "hand_authored", "author": "blackbox-refactor-agents", "created_at": "2026-05-16T00:00:00Z" }
  }
}
