{
  "_contract": "atom/v1",
  "kind": "atom",
  "name": "rust-state-extract",
  "version": 2,
  "subcontract": "refactor/v1",
  "manifest": {
    "description": "Pull a cluster of self.<field> reads into a separate struct, wire as a delegate, and rewrite source-side accesses conservatively.",
    "when_to_use": [
      "5+ fields on a struct are read/written together as a logical cluster",
      "operator wants to break a circular dependency by extracting a sub-state",
      "operator wants to make a field cluster independently testable"
    ],
    "anti_patterns": [
      "do not use to strategize complex initialization order - the atom wires constructors mechanically, not by reasoning about timing",
      "do not use on #[repr(C)] or #[repr(packed)] structs unless the operator supplied the dispatch-side ToolArgDefaults grant",
      "do not use when a different atom (rust-impl-partition-graph) would help operator decide which fields cluster"
    ],
    "inputs": {
      "schema": {
        "type": "object",
        "required": [
          "project_dir",
          "source_file",
          "source_struct",
          "target_struct_name",
          "target_module_path",
          "field_names",
          "delegate_field"
        ],
        "properties": {
          "project_dir": {
            "type": "string"
          },
          "source_file": {
            "type": "string"
          },
          "source_struct": {
            "type": "string"
          },
          "target_struct_name": {
            "type": "string"
          },
          "target_module_path": {
            "type": "string"
          },
          "field_names": {
            "type": "array",
            "minItems": 1,
            "items": {
              "type": "string"
            }
          },
          "delegate_field": {
            "type": "string"
          },
          "apply": {
            "type": "boolean"
          },
          "validation_bin": {
            "type": "string"
          }
        }
      },
      "prompt_template": "You are rust-state-extract. Charter: Pull a cluster of self.<field> reads into a separate struct, wire as a delegate, and rewrite source-side accesses conservatively.\n\nInputs:\nproject_dir={{project_dir}}\nsource_file={{source_file}}\nsource_struct={{source_struct}}\ntarget_struct_name={{target_struct_name}}\ntarget_module_path={{target_module_path}}\nfield_names={{field_names}}\ndelegate_field={{delegate_field}}\napply={{apply}}\nvalidation_bin={{validation_bin}}\n\nProtocol:\n1. Work in code-mode. Ground every name and span with code.*. Consult rust.describe and the relevant analysis.describe contract before first use. Do not call the retired daemon refactor surfaces.\n2. Run analysis.implPartition, identify the requested state fields and their method consumers, then call rust.moveStructFields. Apply the field move, add the delegate field and constructor wiring with fresh code.* spans and edits.*, then call rust.updateCallers. Apply and run the compiler fix loop.\n3. If apply is false, return the transform or advisory result without edits.apply. If apply is true, route every write through edits.begin, edits.merge or edits.createFile, and edits.apply.\n4. After each structural apply, run build.gate with the requested validation command or cargo check --message-format=json. Feed diagnostics to rust.fixRound, merge reviewable changes, apply, and repeat to a fixed point with a hard cap of five rounds. Return rust.fixRound.leftovers as the manual punch list.\n5. No live Rust transform creates arbitrary delegate wiring. Writes, destructures, spreads, ambiguous calls, and nested receivers remain manual. acknowledge_repr can only arrive through dispatch ToolArgDefaults.\n6. Emit bbox_note(kind=\"done\") with the transform, files touched, semantic_status, repair-round count, terminal gate, findings, and leftover count. Emit bbox_note(kind=\"blocked\") when a refusal requires operator authority or unsupported manual work.\n\nStrict rules:\n- Never broaden the requested item set.\n- Never write outside edits.apply.\n- Re-derive spans after every apply.\n- Never cell-author acknowledge_repr or acknowledge_public_api_change. Those grants arrive only through dispatch ToolArgDefaults.\n- Keep lsp.* changes and compiler MachineApplicable replacements unmodified.\n- A target-exists refusal after a successful extract is DONE, not a retry.\n- No retired daemon refactor tools.\n"
    },
    "outputs": {
      "schema": {
        "type": "object",
        "required": [
          "status"
        ],
        "properties": {
          "status": {
            "enum": [
              "planned",
              "applied",
              "blocked",
              "errored"
            ]
          },
          "plan_path": {
            "type": "string"
          },
          "files_touched": {
            "type": "array",
            "items": {
              "type": "string"
            }
          },
          "fixme_count": {
            "type": "object",
            "properties": {
              "plan_only": {
                "type": "integer",
                "minimum": 0
              },
              "warning": {
                "type": "integer",
                "minimum": 0
              }
            }
          },
          "deep_analysis_summary": {
            "type": "object",
            "additionalProperties": true
          },
          "cargo_result": {
            "type": "object",
            "properties": {
              "command": {
                "type": "string"
              },
              "exit_code": {
                "type": "integer"
              },
              "summary": {
                "type": "string"
              },
              "rolled_back": {
                "type": "boolean"
              }
            }
          },
          "block_reason": {
            "type": "string"
          },
          "done_note_id": {
            "type": "string"
          },
          "delegate_field": {
            "type": "string"
          },
          "accessors_generated": {
            "type": "integer",
            "minimum": 0
          },
          "remaining_source_accessors": {
            "type": "integer",
            "minimum": 0
          },
          "unrewriteable_accessors": {
            "type": "integer",
            "minimum": 0
          },
          "borrow_promotions": {
            "type": "integer",
            "minimum": 0
          }
        }
      },
      "evidence_density": "high"
    },
    "effects": {
      "writes_files": true,
      "dispatches_runs": 1,
      "max_depth": 0,
      "uses_network": false
    },
    "composition": {
      "may_invoke_atoms": {
        "kind": "none"
      }
    },
    "implementation": {
      "kind": "profile",
      "brofile_ref": "brofile:rust-refactor-persona@v2"
    },
    "supervision": {
      "oracle": "default"
    },
    "trace": {
      "retain": "summary",
      "portal_focus": "on_attention"
    },
    "cost_class": "normal",
    "provenance": {
      "kind": "hand_authored",
      "author": "blackbox-refactor-agents",
      "created_at": "2026-05-11T00:00:00Z"
    }
  }
}
