{
  "_contract": "atom/v1",
  "kind": "atom",
  "name": "rust-architecture-module-topology-drift",
  "version": 2,
  "subcontract": "refactor/v1",
  "manifest": {
    "description": "Diagnose Rust module trees that no longer represent ownership, crate boundaries, public re-exports, or bin/lib responsibility.",
    "when_to_use": [
      "main.rs, providers.rs, or another module carries unrelated library behavior",
      "mod declarations and re-exports encode history rather than ownership",
      "a correction plan may use rust-extract-to-submodule or rust-bin-to-lib-migration"
    ],
    "anti_patterns": [
      "do not use for module tree generation a tool can produce by itself",
      "do not use for unused imports or dead code",
      "do not hide the G22 caveat when recommending rust-bin-to-lib-migration"
    ],
    "inputs": {
      "schema": {
        "type": "object",
        "required": [
          "project_dir",
          "scope_filter"
        ],
        "properties": {
          "project_dir": {
            "type": "string"
          },
          "scope_filter": {
            "type": "string"
          },
          "target_loci": {
            "type": "array",
            "items": {
              "type": "string"
            }
          },
          "operator_hints": {
            "type": "array",
            "items": {
              "type": "string"
            }
          },
          "layer_model_path": {
            "type": "string"
          },
          "survey_json": {
            "type": "object",
            "additionalProperties": true
          },
          "target_context_window": {
            "type": "integer",
            "minimum": 1000
          },
          "whole_project_mode": {
            "type": "boolean"
          },
          "whiteboard_id": {
            "type": "string"
          }
        }
      },
      "prompt_template": "You are rust-architecture-module-topology-drift. Charter: Diagnose Rust module trees that no longer represent ownership, crate boundaries, public re-exports, or bin/lib responsibility.\n\nInputs:\nproject_dir={{project_dir}}\nscope_filter={{scope_filter}}\ntarget_loci={{target_loci}}\noperator_hints={{operator_hints}}\nlayer_model_path={{layer_model_path}}\nsurvey_json={{survey_json}}\ntarget_context_window={{target_context_window}}\nwhole_project_mode={{whole_project_mode}}\nwhiteboard_id={{whiteboard_id}}\n\nProtocol:\n1. Work in code-mode. Ground current source with code.files, code.items, code.query, code.signature, and code.read. Use analysis.* for reductions and lsp.* for semantic facts. Do not call the retired daemon refactor surfaces.\n2. Run analysis.topLevelDeps on candidate files, use code.items for module declarations, and use lsp.references for semantically important exported items. Distinguish file modules, mod.rs modules, and inline modules.\n3. A diagnosis must name the concrete locus, current owner, conflicting responsibility or lifetime, evidence, predicted failure mode, and confidence. Compiler or SAST facts are evidence, not diagnosis by themselves.\n4. Map accepted repairs to rust.extractItems, rust.inlineModToFile, rust.moduleWiring, and rust.rewriteModuleCallers, then use the compiler fix loop.\n5. If whiteboard_id is present, include one concise claim or concern per surviving candidate in the returned result for the orchestrator to post. Do not call an unavailable whiteboard tool.\n6. Emit bbox_note(kind=\"done\") with hotspot and candidate counts. Return the structured diagnosis and remediation mapping.\n\nStrict rules:\n- Analysis-only. Never apply edits.\n- Stay within scope_filter and target_loci.\n- Do not infer architecture from names alone.\n- Surface unsupported macro, unsafe, public-API, or runtime assumptions.\n- No retired daemon refactor tools.\n"
    },
    "outputs": {
      "schema": {
        "type": "object",
        "required": [
          "status",
          "pathology_atom",
          "diagnosis_candidates"
        ],
        "properties": {
          "status": {
            "enum": [
              "planned",
              "blocked",
              "errored"
            ]
          },
          "pathology_atom": {
            "const": "rust-architecture-module-topology-drift"
          },
          "sast_gate": {
            "type": "object",
            "additionalProperties": true
          },
          "diagnosis_candidates": {
            "type": "array",
            "items": {
              "type": "object"
            }
          },
          "authority_grades": {
            "type": "array",
            "items": {
              "type": "object"
            }
          },
          "evidence_refs": {
            "type": "array",
            "items": {
              "type": "string"
            }
          },
          "atom_mapping": {
            "type": "array",
            "items": {
              "type": "object"
            }
          },
          "remediation_slices": {
            "type": "array",
            "items": {
              "type": "object"
            }
          },
          "acceptance_criteria": {
            "type": "array",
            "items": {
              "type": "object"
            }
          },
          "deferred": {
            "type": "array",
            "items": {
              "type": "object"
            }
          },
          "block_reason": {
            "type": "string"
          },
          "done_note_id": {
            "type": "string"
          }
        }
      },
      "evidence_density": "high"
    },
    "effects": {
      "writes_files": false,
      "dispatches_runs": 1,
      "max_depth": 0,
      "uses_network": false
    },
    "composition": {
      "may_invoke_atoms": {
        "kind": "none"
      }
    },
    "implementation": {
      "kind": "profile",
      "brofile_ref": "brofile:rust-architecture-pathologist@v2"
    },
    "supervision": {
      "oracle": "default"
    },
    "trace": {
      "retain": "summary",
      "portal_focus": "on_attention"
    },
    "cost_class": "normal",
    "provenance": {
      "kind": "hand_authored",
      "author": "blackbox-rust-arch-pathology",
      "created_at": "2026-05-20T00:00:00Z"
    }
  }
}
