{
  "_contract": "atom/v1",
  "kind": "atom",
  "name": "elixir-dialyzer-attribution",
  "version": 1,
  "subcontract": "refactor/v1",
  "manifest": {
    "description": "Map `mix dialyzer --format=short` warnings to defs by line and category via elixir_dialyzer_attribution. v1 is report-only — success-typing warnings have ambiguous remediation; operator consumes the categorized counts.",
    "when_to_use": [
      "post-refactor sanity check that dialyzer warnings didn't increase",
      "diagnostic: triage dialyzer warnings by category before deciding which to address"
    ],
    "anti_patterns": [
      "do not expect auto-fix — dialyzer success-typing warnings often have multiple valid remediations",
      "do not skip the PLT warmup step — dialyzer needs a built PLT to produce meaningful output (operator concern)"
    ],
    "inputs": {
      "schema": {
        "type": "object",
        "required": ["project_dir", "dialyzer_short"],
        "properties": {
          "project_dir": {"type": "string"},
          "dialyzer_short": {"type": "string", "description": "stdout from `mix dialyzer --format=short`."}
        }
      },
      "prompt_template": "You are elixir-dialyzer-attribution. Report-only.\n\nProtocol:\n1. bbox_refactor_plan(kind=\"elixir_dialyzer_attribution\", project_dir=\"{{project_dir}}\", toml_entries={\"dialyzer_short\": \"...\"}).\n2. Surface warnings categorized by {no_return, pattern_match_cov, call_to_missing, unused_type, extra_range, other}.\n3. Emit bbox_note(kind=\"done\", body=<warning total + category breakdown>).\n\nInputs: {{project_dir}} {{dialyzer_short}}"
    },
    "outputs": {
      "schema": {
        "type": "object",
        "required": ["status"],
        "properties": {
          "status": {"enum": ["planned", "applied", "blocked", "errored"]},
          "warnings": {"type": "array"},
          "categorized": {"type": "object"},
          "unactionable_warnings": {"type": "array"}
        }
      },
      "evidence_density": "low"
    },
    "effects": {"writes_files": false, "dispatches_runs": 0, "max_depth": 0, "uses_network": false},
    "composition": {"may_invoke_atoms": {"kind": "none"}},
    "implementation": {"kind": "profile", "brofile_ref": "brofile:elixir-refactor-persona@v1"},
    "supervision": {"oracle": "default"},
    "trace": {"retain": "summary", "portal_focus": "on_attention"},
    "cost_class": "cheap",
    "provenance": {
      "kind": "hand_authored",
      "author": "blackbox-refactor-agents",
      "created_at": "2026-05-16T00:00:00Z"
    }
  }
}
