{
  "_contract": "atom/v1",
  "kind": "atom",
  "name": "java-extract-static-nested-class",
  "version": 1,
  "subcontract": "refactor/v1",
  "manifest": {
    "description": "Move one or more static or implicitly-static Java nested classes to top-level files using extract_java_nested_classes.",
    "when_to_use": [
      "moving a static nested class out before extracting the enclosing class",
      "promote_java_inner_class refused because the nested type is static or implicitly static",
      "splitting helper enum, record, interface, or static class declarations into peer top-level Java files"
    ],
    "anti_patterns": [
      "do not use for non-static inner classes that capture outer state — use java-promote-inner-class",
      "do not use when moving methods or fields with the class — this atom only moves nested type declarations",
      "do not use on non-Java files"
    ],
    "inputs": {
      "schema": {
        "type": "object",
        "required": [
          "project_dir",
          "source",
          "target",
          "item_names"
        ],
        "properties": {
          "project_dir": {
            "type": "string"
          },
          "source": {
            "type": "string",
            "description": "Source file containing the enclosing class, relative to project_dir."
          },
          "target": {
            "type": "string",
            "description": "Target Java file for the extracted top-level nested type(s)."
          },
          "item_names": {
            "type": "array",
            "minItems": 1,
            "items": {
              "type": "string"
            },
            "description": "Nested class/interface/enum/record simple names to move."
          },
          "target_prelude": {
            "type": "string",
            "description": "Optional explicit package/import prelude for the target file."
          },
          "apply": {
            "type": "boolean"
          },
          "validation_cmd": {
            "type": "array",
            "items": {
              "type": "string"
            },
            "description": "Validation command + args. Defaults to [\"mvn\", \"compile\"]."
          }
        }
      },
      "prompt_template": "You are java-extract-static-nested-class. Charter: Move static or implicitly-static Java nested type declarations to top-level Java files.\n\nProtocol:\n\n1. Ground the nested type structurally:\n   bbox_code_symbols(project_dir=\"{{project_dir}}\", query=\"{{item_names}}\",\n                     languages=[\"java\"], item_kinds=[\"class_declaration\", \"interface_declaration\", \"enum_declaration\", \"record_declaration\"])\n   bbox_refactor_status(file=\"{{source}}\", project_dir=\"{{project_dir}}\")\n   Confirm each requested nested type exists inside the source's enclosing class.\n   If the selected declaration is a non-static class that may capture outer state,\n   block and route to java-promote-inner-class instead.\n\n2. Plan with deep_analysis=true:\n   bbox_refactor_plan(kind=\"extract_java_nested_classes\", deep_analysis=true,\n                      project_dir=\"{{project_dir}}\",\n                      source=\"{{source}}\", target=\"{{target}}\",\n                      item_names={{item_names}},\n                      target_prelude=\"{{target_prelude}}\")\n   Inspect source and target edits. The plan strips nested-only modifiers,\n   derives the target package from the target path unless target_prelude is\n   explicit, qualifies surviving sibling-inner references, and validates both\n   source and target with tree-sitter.\n\n3. Decide:\n   - If any requested item is missing, ambiguous, or non-static with outer-state\n     capture risk, emit bbox_note(kind=\"blocked\") and return status=\"blocked\".\n   - Otherwise proceed.\n\n4. Apply (if inputs.apply == true) or return plan-only:\n   bbox_refactor_run(dispatch_origin=\"agent\", confirm=true, steps=[\n     <extract_java_nested_classes step>,\n     {\"op\":\"command\",\"command\":\"<validation_cmd[0]>\",\"args\":<validation_cmd[1..]>,\"required\":true}\n   ])\n   Default validation_cmd is [\"mvn\", \"compile\"].\n\n5. Emit done note:\n   bbox_note(kind=\"done\", body=<one-line summary: source, target,\n     nested types moved, package mode, validation result>).\n\nStrict refusal rules (prompt-discipline; not enforced at dispatch):\n- Never call any tool outside the refactor persona tool surface.\n- Never use this atom for capture-bearing non-static inner classes.\n- Never invent nested class names from prose; re-derive them structurally.\n- Never apply when status=blocked.\n\nInputs:\n{{project_dir}} {{source}} {{target}} {{item_names}} {{target_prelude}} {{apply}} {{validation_cmd}}"
    },
    "outputs": {
      "schema": {
        "type": "object",
        "required": [
          "status"
        ],
        "properties": {
          "status": {
            "enum": [
              "planned",
              "applied",
              "blocked",
              "errored"
            ]
          },
          "plan_path": {
            "type": "string"
          },
          "files_touched": {
            "type": "array",
            "items": {
              "type": "string"
            }
          },
          "fixme_count": {
            "type": "object",
            "properties": {
              "plan_only": {
                "type": "integer",
                "minimum": 0
              },
              "warning": {
                "type": "integer",
                "minimum": 0
              }
            }
          },
          "deep_analysis_summary": {
            "type": "object",
            "additionalProperties": true
          },
          "cargo_result": {
            "type": "object",
            "properties": {
              "command": {
                "type": "string"
              },
              "exit_code": {
                "type": "integer"
              },
              "summary": {
                "type": "string"
              },
              "rolled_back": {
                "type": "boolean"
              }
            }
          },
          "block_reason": {
            "type": "string"
          },
          "done_note_id": {
            "type": "string"
          },
          "nested_types_moved": {
            "type": "array",
            "items": {
              "type": "string"
            }
          },
          "target_file": {
            "type": "string"
          }
        }
      },
      "evidence_density": "high"
    },
    "effects": {
      "writes_files": true,
      "dispatches_runs": 1,
      "max_depth": 0,
      "uses_network": false
    },
    "composition": {
      "may_invoke_atoms": {
        "kind": "none"
      }
    },
    "implementation": {
      "kind": "profile",
      "brofile_ref": "brofile:java-refactor-persona@v1"
    },
    "supervision": {
      "oracle": "default"
    },
    "trace": {
      "retain": "summary",
      "portal_focus": "on_attention"
    },
    "cost_class": "normal",
    "provenance": {
      "kind": "hand_authored",
      "author": "blackbox-refactor-agents",
      "created_at": "2026-05-13T00:00:00Z"
    }
  }
}
