{
  "_contract": "atom/v1",
  "kind": "atom",
  "name": "java-architecture-anemic-data-remote-behavior",
  "version": 1,
  "subcontract": "refactor/v1",
  "manifest": {
    "description": "Diagnose Java behavior living on the wrong side of a data-behavior split.",
    "when_to_use": [
      "helpers, processors, or services repeatedly mine the same DTO or data holder for domain behavior",
      "getter density is visible but deciding the missing behavior home requires semantic judgment",
      "a correction plan needs behavior relocation or consolidation around a domain concept"
    ],
    "anti_patterns": [
      "do not use for legitimate framework DTOs with no behavior pressure",
      "do not use for primitive-to-value-object cleanup by itself",
      "do not use on non-Java targets"
    ],
    "inputs": {
      "schema": {
        "type": "object",
        "required": ["project_dir", "scope_filter"],
        "properties": {
          "project_dir": { "type": "string" },
          "scope_filter": { "type": "string" },
          "target_loci": { "type": "array", "items": { "type": "string" } },
          "operator_hints": { "type": "array", "items": { "type": "string" } },
          "layer_model_path": { "type": "string" },
          "survey_json": { "type": "object", "additionalProperties": true },
          "target_context_window": { "type": "integer", "minimum": 1000 },
          "whole_project_mode": { "type": "boolean" },
          "whiteboard_id": { "type": "string" }
        }
      },
      "prompt_template": "You are java-architecture-anemic-data-remote-behavior. Diagnostic question: does behavior live on the wrong side of a Java data-behavior split?\n\nInputs:\nproject_dir={{project_dir}}\nscope_filter={{scope_filter}}\ntarget_loci={{target_loci}}\noperator_hints={{operator_hints}}\nlayer_model_path={{layer_model_path}}\nsurvey_json={{survey_json}}\ntarget_context_window={{target_context_window}}\nwhole_project_mode={{whole_project_mode}}\nwhiteboard_id={{whiteboard_id}}\n\nProtocol:\n1. Cheap grounding first. Use bbox_code_symbols and bbox_code_refs to inspect data holders, getter-heavy callers, fields, and tests. Use bbox_refactor_status for concrete files. For class loci, use bbox_refactor_plan:java_class_dependency_analysis through bbox_refactor_plan(kind=\"java_class_dependency_analysis\", deep_analysis=true, project_dir=\"{{project_dir}}\", source=<file>, module_name=<class>).\n2. Apply the SAST gate. A data-only class or getter count is not enough. A valid pathology claim identifies data holder, remote behavior owners, access density, and why framework-data cases should or should not be left alone.\n3. Propose slices that move or consolidate behavior around the domain concept without changing intentional DTO boundaries.\n4. If whiteboard_id is non-empty, post one whiteboard_post claim or concern for each surviving data-behavior diagnosis.\n5. Emit bbox_note:done with data holder count and candidate count. Return strict JSON only: status, pathology_atom, sast_gate, diagnosis_candidates, evidence_refs, remediation_slices, acceptance_criteria, deferred, block_reason."
    },
    "outputs": {
      "schema": {
        "type": "object",
        "required": ["status", "pathology_atom", "diagnosis_candidates"],
        "properties": {
          "status": { "enum": ["planned", "blocked", "errored"] },
          "pathology_atom": { "const": "java-architecture-anemic-data-remote-behavior" },
          "sast_gate": { "type": "object", "additionalProperties": true },
          "diagnosis_candidates": { "type": "array", "items": { "type": "object" } },
          "evidence_refs": { "type": "array", "items": { "type": "string" } },
          "remediation_slices": { "type": "array", "items": { "type": "object" } },
          "acceptance_criteria": { "type": "array", "items": { "type": "object" } },
          "deferred": { "type": "array", "items": { "type": "object" } },
          "block_reason": { "type": "string" },
          "done_note_id": { "type": "string" }
        }
      },
      "evidence_density": "high"
    },
    "effects": { "writes_files": false, "dispatches_runs": 1, "max_depth": 0, "uses_network": false },
    "composition": { "may_invoke_atoms": { "kind": "none" } },
    "implementation": { "kind": "profile", "brofile_ref": "brofile:java-architecture-pathologist@v1" },
    "supervision": { "oracle": "default" },
    "trace": { "retain": "summary", "portal_focus": "on_attention" },
    "cost_class": "normal",
    "provenance": { "kind": "hand_authored", "author": "blackbox-arch-pathology", "created_at": "2026-05-18T00:00:00Z" }
  }
}
